{
  "$schema": "https://json-schema.org/draft/2020-12/schema",
  "type": "object",
  "properties": {
    "schema_version": {
      "type": "string",
      "const": "1.0.0"
    },
    "id": {
      "type": "string",
      "format": "uuid",
      "pattern": "^([0-9a-fA-F]{8}-[0-9a-fA-F]{4}-[1-8][0-9a-fA-F]{3}-[89abAB][0-9a-fA-F]{3}-[0-9a-fA-F]{12}|00000000-0000-0000-0000-000000000000|ffffffff-ffff-ffff-ffff-ffffffffffff)$"
    },
    "session_id": {
      "type": "string",
      "format": "uuid",
      "pattern": "^([0-9a-fA-F]{8}-[0-9a-fA-F]{4}-[1-8][0-9a-fA-F]{3}-[89abAB][0-9a-fA-F]{3}-[0-9a-fA-F]{12}|00000000-0000-0000-0000-000000000000|ffffffff-ffff-ffff-ffff-ffffffffffff)$"
    },
    "owner_id": {
      "type": "string",
      "format": "uuid",
      "pattern": "^([0-9a-fA-F]{8}-[0-9a-fA-F]{4}-[1-8][0-9a-fA-F]{3}-[89abAB][0-9a-fA-F]{3}-[0-9a-fA-F]{12}|00000000-0000-0000-0000-000000000000|ffffffff-ffff-ffff-ffff-ffffffffffff)$"
    },
    "kind": {
      "type": "string",
      "enum": [
        "transcript_span",
        "audio_summary",
        "frame_observation"
      ]
    },
    "modality": {
      "type": "string",
      "enum": [
        "audio",
        "video",
        "transcript"
      ]
    },
    "packet_ids": {
      "minItems": 1,
      "type": "array",
      "items": {
        "type": "string",
        "format": "uuid",
        "pattern": "^([0-9a-fA-F]{8}-[0-9a-fA-F]{4}-[1-8][0-9a-fA-F]{3}-[89abAB][0-9a-fA-F]{3}-[0-9a-fA-F]{12}|00000000-0000-0000-0000-000000000000|ffffffff-ffff-ffff-ffff-ffffffffffff)$"
      }
    },
    "start_ms": {
      "type": "integer",
      "minimum": 0,
      "maximum": 9007199254740991
    },
    "end_ms": {
      "type": "integer",
      "minimum": 0,
      "maximum": 9007199254740991
    },
    "text": {
      "type": "string",
      "maxLength": 20000
    },
    "confidence": {
      "type": "number",
      "minimum": 0,
      "maximum": 1
    },
    "created_at_ms": {
      "type": "integer",
      "minimum": 0,
      "maximum": 9007199254740991
    }
  },
  "required": [
    "schema_version",
    "id",
    "session_id",
    "owner_id",
    "kind",
    "modality",
    "packet_ids",
    "start_ms",
    "end_ms",
    "text",
    "confidence",
    "created_at_ms"
  ],
  "additionalProperties": false
}
